Neighborhood,Latitude,Longitude,Borough,City
"Tierparkstraße (Isar-Eingang), Tierparkstraße, Bezirksteil Siebenbrunn, Untergiesing-Harlaching, München, Bayern, 81543, Deutschland",48.1006198,11.5514237,Bezirksteil Siebenbrunn,munich
"90, Säbener Straße, Bezirksteil Giesing, Untergiesing-Harlaching, München, Bayern, 81547, Deutschland",48.10192975,11.571492406240349,Bezirksteil Giesing,munich
"22, Hohenschwangaustraße, Bezirksteil Obergiesing, Obergiesing-Fasangarten, München, Bayern, 81549, Deutschland",48.1024839,11.5916676,Bezirksteil Obergiesing,munich
"107, Görzer Straße, Balanstraße-West, Bezirksteil Balanstraße-West, Ramersdorf-Perlach, München, Bayern, 81549, Deutschland",48.1030278,11.6115562,Bezirksteil Balanstraße-West,munich
"11, Johann-Houis-Straße, Bezirksteil Mittersendling, Sendling-Westpark, München, Bayern, 81369, Deutschland",48.1119596,11.520543,Bezirksteil Mittersendling,munich
"Brudermühlstraße, Bezirksteil Sendlinger Feld, Sendling, München, Bayern, 81371, Deutschland",48.11259310172631,11.540597265808003,Bezirksteil Sendlinger Feld,munich
"Brudermühlbrücke, Brudermühlstraße, Bezirksteil Sendlinger Feld, Sendling, München, Bayern, 81379, Deutschland",48.1126172,11.56015094349111,Bezirksteil Sendlinger Feld,munich
"Spielplatz an der Herzogstandstraße ""Louisoderspielplatz"", Kesselbergstraße, Bezirksteil Obergiesing, Obergiesing-Fasangarten, München, Bayern, 81539, Deutschland",48.1138543,11.581082016046512,Bezirksteil Obergiesing,munich
"15, Ruppertsberger Straße, Bezirksteil Balanstraße-West, Ramersdorf-Perlach, München, Bayern, 81539, Deutschland",48.114604850000006,11.600868099999998,Bezirksteil Balanstraße-West,munich
"6, Raiffeisenplatz, Ramersdorf, Bezirksteil Ramersdorf, Ramersdorf-Perlach, München, Bayern, 81735, Deutschland",48.1148751,11.6209519,Bezirksteil Ramersdorf,munich
"Bienenhaus, Heiterwanger Straße, Bezirksteil Mittersendling, Sendling-Westpark, München, Bayern, 81373, Deutschland",48.122936949999996,11.529192301957217,Bezirksteil Mittersendling,munich
"Kreisverwaltungsreferat, 19, Ruppertstraße, Am Schlachthof, Bezirksteil Am Schlachthof, Ludwigsvorstadt-Isarvorstadt, München, Bayern, 80337, Deutschland",48.12434935,11.550165205178768,Bezirksteil Am Schlachthof,munich
"Mittelschule Wittelsbacherstraße, 10, Wittelsbacherstraße, Bezirksteil Glockenbach, Ludwigsvorstadt-Isarvorstadt, München, Bayern, 80469, Deutschland",48.12504685,11.570254605238468,Bezirksteil Glockenbach,munich
"28, Franziskanerstraße, Bezirksteil Obere Au, Au-Haidhausen, München, Bayern, 81669, Deutschland",48.125775,11.5900335,Bezirksteil Obere Au,munich
"Alpha, August-Everding-Straße, Bezirksteil Echarding, Berg am Laim, München, Bayern, 81671, Deutschland",48.12664,11.610809755051587,Bezirksteil Echarding,munich
"27, Josephsburgstraße, Bezirksteil Josephsburg, Berg am Laim, München, Bayern, 81673, Deutschland",48.1270699,11.6305353,Bezirksteil Josephsburg,munich
"Zschokkestraße, Neu-Friedenheim, Bezirksteil Friedenheim, Laim, München, Bayern, 80686, Deutschland",48.134955861970695,11.518893194345257,Bezirksteil Friedenheim,munich
"Golling Hairstyling, Gollierstraße, Bezirksteil Westend, Schwanthalerhöhe, München, Bayern, 80339, Deutschland",48.1358604,11.5390296,Bezirksteil Westend,munich
"40, Landwehrstraße, Bezirksteil Ludwigsvorstadt-Kliniken, Ludwigsvorstadt-Isarvorstadt, München, Bayern, 80336, Deutschland",48.13649085,11.559117781663584,Bezirksteil Ludwigsvorstadt-Kliniken,munich
"2, Orlandostraße, Bezirksteil Graggenau, Altstadt-Lehel, München, Bayern, 80331, Deutschland",48.1372002,11.5792665,Bezirksteil Graggenau,munich
"510, Zufahrt Liegendkranke, Bezirksteil Steinhausen, Au-Haidhausen, München, Bayern, 81675, Deutschland",48.13769405,11.59934542102122,Bezirksteil Steinhausen,munich
"155, Prinzregentenstraße, Parkstadt Bogenhausen, Bezirksteil Parkstadt, Bogenhausen, München, Bayern, 81677, Deutschland",48.1382992,11.6193003,Bezirksteil Parkstadt,munich
"Töginger Straße, Zamdorf, Bezirksteil Englschalking, Bogenhausen, München, Bayern, 81929, Deutschland",48.13895856240813,11.639658078998531,Bezirksteil Englschalking,munich
"159, Arnulfstraße, Siedlung Neuhausen, Bezirksteil Neuhausen, Neuhausen-Nymphenburg, München, Bayern, 80634, Deutschland",48.1473745,11.528187245156083,Bezirksteil Neuhausen,munich
"Grundschule an der Blutenburgstraße, Adamstraße, Bezirksteil Marsfeld, Maxvorstadt, München, Bayern, 80636, Deutschland",48.1477886,11.547987240960534,Bezirksteil Marsfeld,munich
"0, 21, Arcisstraße, Bezirksteil Königsplatz, Maxvorstadt, München, Bayern, 80333, Deutschland",48.14873035,11.568510240272179,Bezirksteil Königsplatz,munich
"Burgfriedensäule, Burgfriedenweg, Bezirksteil Englischer Garten Süd, Altstadt-Lehel, München, Bayern, 80538, Deutschland",48.149442,11.5890865,Bezirksteil Englischer Garten Süd,munich
"18, Scheinerstraße, Altbogenhausen, Bezirksteil Altbogenhausen, Bogenhausen, München, Bayern, 81679, Deutschland",48.1497242,11.608753,Bezirksteil Altbogenhausen,munich
"24, Vollmannstraße, Parkstadt Bogenhausen, Bezirksteil Parkstadt, Bogenhausen, München, Bayern, 81927, Deutschland",48.1503708,11.6287498,Bezirksteil Parkstadt,munich
"56, Südliche Auffahrtsallee, Villenkolonie Neuwittelsbach, Bezirksteil Nymphenburg, Neuhausen-Nymphenburg, München, Bayern, 80639, Deutschland",48.1583551,11.5174847,Bezirksteil Nymphenburg,munich
"Dom-Pedro-Straße, Landshuter Allee, Bezirksteil Dom Pedro, Neuhausen-Nymphenburg, München, Bayern, 80637, Deutschland",48.1594631,11.537626,Bezirksteil Dom Pedro,munich
"17, Kathi-Kobus-Straße, Ackermannbogen, Bezirksteil Schwere-Reiter-Straße, Schwabing-West, München, Bayern, 80797, Deutschland",48.1598771,11.5575477,Bezirksteil Schwere-Reiter-Straße,munich
"18, Römerstraße, Bezirksteil Neuschwabing, Schwabing-West, München, Bayern, 80801, Deutschland",48.1605125,11.5775862,Bezirksteil Neuschwabing,munich
"Bootsverleih, Kleinhesselohe, Bezirksteil Kleinhesselohe, Schwabing-Freimann, München, Bayern, 80802, Deutschland",48.16122,11.5979562,Bezirksteil Kleinhesselohe,munich
"Brunnbachleite, Herzogpark, Bezirksteil Herzogpark, Bogenhausen, München, Bayern, 81925, Deutschland",48.16196132549815,11.61789167220683,Bezirksteil Herzogpark,munich
"Olympiasee, Spiridon-Louis-Ring, Olympiapark, Bezirksteil Am Riesenfeld, Milbertshofen-Am Hart, München, Bayern, 80809, Deutschland",48.1712937,11.5464391,Bezirksteil Am Riesenfeld,munich
"1, Burgunderstraße, Bezirksteil Am Luitpoldpark, Schwabing-West, München, Bayern, 80804, Deutschland",48.17183865,11.566810106246315,Bezirksteil Am Luitpoldpark,munich
"174, Leopoldstraße, Bezirksteil Münchener Freiheit, Schwabing-Freimann, München, Bayern, 80804, Deutschland",48.1722903,11.586903,Bezirksteil Münchener Freiheit,munich
"Werneckstraße, Alte Heide-Hirschau, Bezirksteil Alte Heide - Hirschau, Schwabing-Freimann, München, Bayern, 80805, Deutschland",48.1726659,11.6073847,Bezirksteil Alte Heide - Hirschau,munich
